[{"schemaVersion":"1.0","outcomeId":"out-1","sessionId":"advisory-session","invocationId":"invoke-1","sequence":1,"command":"test","exitCode":0,"timestamp":"2026-01-01T00:00:30Z","obligationId":"o1","verdict":"pass","sourceDigest":"aaaaaaaaaaaaaaaaaaaaaaaaaaaaaaaaaaaaaaaaaaaaaaaaaaaaaaaaaaaaaaaa"},{"schemaVersion":"1.0","outcomeId":"out-2","sessionId":"advisory-session","invocationId":"invoke-2","sequence":2,"command":"test","exitCode":1,"timestamp":"2026-01-01T00:02:30Z","obligationId":"o2","verdict":"fail","sourceDigest":"bbbbbbbbbbbbbbbbbbbbbbbbbbbbbbbbbbbbbbbbbbbbbbbbbbbbbbbbbbbbbbbb"}]
