[{"schemaVersion":"1.0","outcomeId":"dup","sessionId":"session-001","invocationId":"inv-001","sequence":0,"command":"gate","exitCode":0,"timestamp":"2026-01-01T00:00:30Z","obligationId":"obl-1","verdict":"pass","sourceDigest":"0000000000000000000000000000000000000000000000000000000000000000"},{"schemaVersion":"1.0","outcomeId":"dup","sessionId":"session-001","invocationId":"inv-002","sequence":1,"command":"gate","exitCode":1,"timestamp":"2026-01-01T00:02:30Z","obligationId":"obl-1","verdict":"fail","sourceDigest":"1111111111111111111111111111111111111111111111111111111111111111"}]
